{"schema_version":"0.1.0","command":"graph","status":"ok","exit_code":0,"data":{"format":"text","freshness":"hit","graph":{"edges":[{"from":"demo","rel":"governed-by","to":"policy:takogami.agent"},{"from":"demo","rel":"provides","to":"capability:build"},{"from":"demo","rel":"uses","to":"capability:build"},{"from":"profile:workspace-dev","rel":"selects","to":"policy:takogami.agent"}],"generated_at":"2026-07-25T00:00:00Z","nodes":[{"id":"demo","kind":"package"},{"id":"policy:takogami.agent","kind":"policy"},{"id":"capability:build","kind":"capability"},{"id":"profile:workspace-dev","kind":"profile"}],"registry_generation":{"generated_at":"2026-07-25T00:00:00Z","source_fingerprints":[{"algorithm":"sha256","digest":"8d19f14c5377db3f12cb99d52d6e33bc0611f8cf438ff695f06bd8e7f2d52953","path":"registry/policies.json"},{"algorithm":"sha256","digest":"d0e3e41214b2a1c588d98e45f78567cfb5a0260e0b46d292d559d072397f197f","path":"registry/profiles.json"},{"algorithm":"sha256","digest":"76ec6918d937caaba8649ab56edd2a8b45c1cc06a5417803e5bee11aa9af2316","path":"registry/skills.json"},{"algorithm":"sha256","digest":"f2d442b08c139a3214f2739565735e0ae8d1d2ddca76eef207c2a91765e9c2ea","path":"registry/units.json"}]}},"rendered":"Graph freshness: hit\nGenerated at: 2026-07-25T00:00:00Z\nNodes: 4\nEdges: 4\n\ndemo -governed-by-> policy:takogami.agent\ndemo -provides-> capability:build\ndemo -uses-> capability:build\nprofile:workspace-dev -selects-> policy:takogami.agent\n"},"diagnostics":[],"metrics":{"registry_cache":"hit","output_bytes":0,"compressor":"none"}}
